{
  "audit_path": [
    {
      "position": "left",
      "sibling_hash": "c28048f1415262900efc0c720e6f8bea7500d7b8128ae129820423242a10dacf"
    },
    {
      "position": "right",
      "sibling_hash": "663eae490110a72182af696c43f5c7f7ac19a718f05a6000f8931233a623b6f9"
    }
  ],
  "export_generation": 1,
  "export_root": "aae69af634f328ce701799c7d9e6a7b67403733e0c9f2ddd7de42469e17dcc00",
  "leaf_hash": "7bbb30d792db2589050c4960325e7d1163b3aa51145a30a61c56e8463b6f364e",
  "leaf_index": 1,
  "profile": "tc-ledger/1",
  "room": "demo-room",
  "schema": "tc-ledger/inclusion-proof/v1",
  "tree_size": 4,
  "version": 1
}
